{
  "authorization_date": "2026-07-24",
  "authorization_id": "STAGE-A-DEVELOPMENT-ACCEPTANCE-V2-ACTIVE",
  "authorization_sha256": "0e99fd3ff210309049d97abb989652d747fa5f05c561a6566b25cda3d0eb8f74",
  "authorization_status": "AUTHORIZED",
  "authorization_version": "1",
  "authorized_acceptance_root": "C:\\Users\\johns\\satnet-stage-a-discovery-v1-acceptance",
  "authorized_artifact_contract_hash": "cc721fd88dedcb90c0aa789b7815c7f6e35132e3aeebf2794e3e1d63a424380d",
  "authorized_contract_hash": "e88b2f3f3fd545a2876e79262be73901eb77a656e08835ff01aeb52d6a9ba51a",
  "authorized_contract_tag": "stage-a-discovery-contract-v1",
  "authorized_executable_inventory_hash": "2ebac3bb615ed3204edc1359a78f78e4354495364fa1f76dfd1648b417df7b56",
  "authorized_frozen_commit": "301d8a224daa070b15ecc6447f503d42d5d1e70a",
  "authorized_generation_root": "C:\\Users\\johns\\satnet-stage-a-discovery-v1-production",
  "authorized_operation": "ACCEPT",
  "authorized_partition": "development",
  "authorized_replay_root": "C:\\Users\\johns\\satnet-stage-a-discovery-v1-replay",
  "authorized_run_count": 100,
  "authorized_run_ids": [
    500,
    501,
    502,
    503,
    504,
    505,
    506,
    507,
    508,
    509,
    510,
    511,
    512,
    513,
    514,
    515,
    516,
    517,
    518,
    519,
    520,
    521,
    522,
    523,
    524,
    525,
    526,
    527,
    528,
    529,
    530,
    531,
    532,
    533,
    534,
    535,
    536,
    537,
    538,
    539,
    560,
    561,
    562,
    563,
    564,
    565,
    566,
    567,
    568,
    569,
    570,
    571,
    572,
    573,
    574,
    575,
    576,
    577,
    578,
    579,
    580,
    581,
    582,
    583,
    584,
    585,
    586,
    587,
    588,
    589,
    590,
    591,
    592,
    593,
    594,
    595,
    596,
    597,
    598,
    599,
    620,
    621,
    622,
    623,
    624,
    625,
    626,
    627,
    628,
    629,
    630,
    631,
    632,
    633,
    634,
    635,
    636,
    637,
    638,
    639
  ],
  "authorized_stable_executable_commit": "b1da92c3184ee86997079f1eb458fae95d994c22",
  "authorized_tooling_proposal_hash": "7b21af1bad6faa10696d1417b28b75300727033446c84424beb94d263510778b",
  "authorizing_decision_reference": "Explicit user approval on 2026-07-24 following independent audit commit 3d26f5c3071bf7de158573947e480da782d394bd verdict APPROVED FOR EXPLICIT USER-CONTROLLED STAGE A DEVELOPMENT ACCEPTANCE AUTHORIZATION V2 ACTIVATION",
  "independently_approved": true,
  "schema_identifier": "satnet.stage_a.execution_authorization.v1",
  "source_generation_ledger_byte_length": 1060132,
  "source_generation_ledger_relative_path": "execution_ledger.json",
  "source_generation_ledger_sha256": "9df1448612d4719d164cf014a2ab60d932d82ab07a90e05c50a0c1650b097328",
  "source_replay_ledger_byte_length": 1079014,
  "source_replay_ledger_relative_path": "replay_ledger.json",
  "source_replay_ledger_sha256": "140bda39b3f519d7baeae09d222cd3f6c80791ff03215c11c48dd66fb6e8b9bb"
}
