{
  "authorization_date": "2026-07-23",
  "authorization_id": "STAGE-A-DEVELOPMENT-REPLAY-V1-ACTIVE",
  "authorization_sha256": "ef0f2c2bf90a691bb7a479054257d3ca4d9794eb73f30ec5f5e43eda7ce2d4c9",
  "authorization_status": "AUTHORIZED",
  "authorization_version": "1",
  "authorized_acceptance_root": "C:\\Users\\johns\\satnet-stage-a-discovery-v1-acceptance",
  "authorized_artifact_contract_hash": "cc721fd88dedcb90c0aa789b7815c7f6e35132e3aeebf2794e3e1d63a424380d",
  "authorized_contract_hash": "e88b2f3f3fd545a2876e79262be73901eb77a656e08835ff01aeb52d6a9ba51a",
  "authorized_contract_tag": "stage-a-discovery-contract-v1",
  "authorized_executable_inventory_hash": "1066d17645d4975a40a93a80c1ca9797b1b28cf37531337355ccb3297fd13b2d",
  "authorized_frozen_commit": "301d8a224daa070b15ecc6447f503d42d5d1e70a",
  "authorized_generation_root": "C:\\Users\\johns\\satnet-stage-a-discovery-v1-production",
  "authorized_operation": "REPLAY",
  "authorized_partition": "development",
  "authorized_replay_root": "C:\\Users\\johns\\satnet-stage-a-discovery-v1-replay",
  "authorized_run_count": 100,
  "authorized_run_ids": [
    500,
    501,
    502,
    503,
    504,
    505,
    506,
    507,
    508,
    509,
    510,
    511,
    512,
    513,
    514,
    515,
    516,
    517,
    518,
    519,
    520,
    521,
    522,
    523,
    524,
    525,
    526,
    527,
    528,
    529,
    530,
    531,
    532,
    533,
    534,
    535,
    536,
    537,
    538,
    539,
    560,
    561,
    562,
    563,
    564,
    565,
    566,
    567,
    568,
    569,
    570,
    571,
    572,
    573,
    574,
    575,
    576,
    577,
    578,
    579,
    580,
    581,
    582,
    583,
    584,
    585,
    586,
    587,
    588,
    589,
    590,
    591,
    592,
    593,
    594,
    595,
    596,
    597,
    598,
    599,
    620,
    621,
    622,
    623,
    624,
    625,
    626,
    627,
    628,
    629,
    630,
    631,
    632,
    633,
    634,
    635,
    636,
    637,
    638,
    639
  ],
  "authorized_stable_executable_commit": "fafe3fe36eac4429c860bd6d281923fed2980ea7",
  "authorized_tooling_proposal_hash": "7b21af1bad6faa10696d1417b28b75300727033446c84424beb94d263510778b",
  "authorizing_decision_reference": "Explicit user approval on 2026-07-23 following independent audit commit b9dc53715f8d814dce6f071595f15527b990dae1 verdict APPROVED FOR EXPLICIT USER-CONTROLLED STAGE A DEVELOPMENT REPLAY AUTHORIZATION ACTIVATION",
  "independently_approved": true,
  "schema_identifier": "satnet.stage_a.execution_authorization.v1",
  "source_generation_ledger_byte_length": 1060132,
  "source_generation_ledger_relative_path": "execution_ledger.json",
  "source_generation_ledger_sha256": "9df1448612d4719d164cf014a2ab60d932d82ab07a90e05c50a0c1650b097328",
  "source_replay_ledger_byte_length": null,
  "source_replay_ledger_relative_path": null,
  "source_replay_ledger_sha256": null
}
